{
  "record": "attempt",
  "schema_version": 1,
  "run_id": "run-0001",
  "node": {
    "graph_id": "review_pilot",
    "node_id": "cs_ci",
    "revision": 2
  },
  "number": 2,
  "owner": "controller:fire-starter/4242",
  "started_at": "2026-09-06T14:00:00Z",
  "input_manifest": [
    {
      "port_name": "check_logs",
      "locator": "local:verifier/run-0001/cs_ci/1/checks.jsonl",
      "subject": "commit:918a8431ec8d46b19029e3ecbbb77e785b25716c",
      "version": "1",
      "content_digest": "sha256:8c3b4974891cb0893d8d5f1348c7f3ab4b93feddc10dd99f57a64daa91ae07c1",
      "provenance": {
        "producer": "checkspan-local-controller"
      },
      "policy_ref": {
        "id": "local_evidence",
        "version": 1
      }
    }
  ],
  "dependency_receipts": [
    {
      "id": "rcpt-patch-1",
      "run_id": "run-0001",
      "node": {
        "graph_id": "review_pilot",
        "node_id": "cs_patch",
        "revision": 1
      }
    }
  ],
  "repair_hint": "Only the null-input branch of the parser failed; the obligation is unchanged.",
  "finished_at": "2026-09-06T14:05:00Z",
  "execution": {
    "outcome": "completed"
  },
  "result": {
    "type": {
      "schema_id": "software_check_result",
      "version": 1,
      "digest": "sha256:0becd597a566edc0c39157dcd20e1a9b27aea5eefaa175688a551cee7b0f6866"
    },
    "artifact_ref": "store:results/run-0001/cs_ci/1",
    "digest": "sha256:eac01717c53e48bf388e22589c0c311fa0ee08f6ad25e7faea65e0bb303ae19e"
  },
  "produced_evidence": [
    {
      "port_name": "produced_logs",
      "locator": "local:verifier/run-0001/cs_ci/2/checks.jsonl",
      "subject": "commit:918a8431ec8d46b19029e3ecbbb77e785b25716c",
      "version": "2",
      "content_digest": "sha256:8c3b4974891cb0893d8d5f1348c7f3ab4b93feddc10dd99f57a64daa91ae07c1",
      "provenance": {
        "producer": "checkspan-local-controller"
      },
      "policy_ref": {
        "id": "local_evidence",
        "version": 1
      }
    }
  ]
}
